{
  "plot_title": "Citric Acid Raman Spectra",
  "x_axis_label": "Raman shift (cm⁻¹)",
  "y_axis_label": "Raman intensity (a.u.)",
  "x_tick_min": 400,
  "x_tick_max": 1800,
  "y_tick_min": 0,
  "y_tick_max": 3000,
  "x_scale": "linear",
  "y_scale": "linear",
  "x_reversed": false,
  "y_reversed": false,
  "y_calibration": "axis",
  "spectrum_type": "Raman",
  "bounding_box": {
    "x_min": 197,
    "y_min": 49,
    "x_max": 954,
    "y_max": 610
  },
  "image_width": 1024,
  "image_height": 715,
  "low_resolution": false,
  "curves": [
    {
      "label": "citric acid aqueous solution",
      "color_hint": "#000000",
      "region": { "y_min": 49, "y_max": 440 }
    },
    {
      "label": "citric acid solid",
      "color_hint": "#cd4440",
      "region": { "y_min": 300, "y_max": 610 }
    }
  ],
  "annotations": []
}
