{
  "plot_title": "Stacked Raman Spectra",
  "x_axis_label": "Raman shift (cm⁻¹)",
  "y_axis_label": "Intensity (a.u.)",
  "x_tick_min": 200,
  "x_tick_max": 3500,
  "y_tick_min": 0,
  "y_tick_max": 1,
  "x_scale": "linear",
  "y_scale": "linear",
  "x_reversed": false,
  "y_reversed": false,
  "y_calibration": "per_curve_normalized",
  "spectrum_type": "Raman",
  "bounding_box": {
    "x_min": 46,
    "y_min": 50,
    "x_max": 1155,
    "y_max": 643
  },
  "image_width": 1176,
  "image_height": 728,
  "low_resolution": false,
  "curves": [
    {
      "label": "Polyethylene",
      "color_hint": "#1f77b4",
      "region": { "y_min": 349, "y_max": 643 }
    },
    {
      "label": "Polystyrene",
      "color_hint": "#d62728",
      "region": { "y_min": 258, "y_max": 438 }
    },
    {
      "label": "Nylon 6,6",
      "color_hint": "#2ca02c",
      "region": { "y_min": 50, "y_max": 259 }
    }
  ],
  "annotations": []
}
