{
  "plot_title": "PMMA",
  "x_axis_label": "Raman shift (cm⁻¹)",
  "y_axis_label": "Intensity",
  "x_tick_min": 250,
  "x_tick_max": 3500,
  "y_tick_min": 0.0,
  "y_tick_max": 1.0,
  "x_scale": "linear",
  "y_scale": "linear",
  "bounding_box": {
    "x_min": 70,
    "y_min": 55,
    "x_max": 715,
    "y_max": 458
  },
  "x_reversed": false,
  "y_reversed": false,
  "y_calibration": "axis",
  "spectrum_type": "Raman",
  "notes": "Single blue spectrum. Bounding box encloses inner plot area."
}
